名字,链接,地址,介绍,开放时间,图片链接,评分,建议游玩时间,建议季节,门票,小贴士,Page
勃利森林公园Boli Forest Park,http://travel.qunar.com/p-oi20952570-bolisenlingongyuan,,地处勃利县西南方，主景区面积9200公顷，生态特点极为突出，在山间沟谷中，植被随着海拔的变化而变化，沼泽湿地溪水川流，多生有连生植物群。,,https://tr-osdcp.qunarzz.com/tr-osd-tr-manager/img/bcc0717eec126740d32cebc458ff4b41.jpg_480x360x95_65a3c183.jpg,5.0,建议游览时间：12小时 - 3天,,具体收费情况以现场公示为主,,2
亿达广场Yida Square,http://travel.qunar.com/p-oi19977507-yidaguangchang,,,,,5.0,,,具体收费情况以现场公示为主,,2
龙泉寺Longquan Temple,http://travel.qunar.com/p-oi19968192-longquansi,,,,,5.0,,,具体收费情况以现场公示为主,,3
南山公园Nan Mountain Park,http://travel.qunar.com/p-oi19968148-nanshangongyuan,,"南山公园位于勃利县，公园建在群山之中，非常漂亮，园内有荷花塘和小溪，还有很多健身器材。
",,,5.0,建议游览时间：2小时 - 3小时,,具体收费情况以现场公示为主,,3
