名字,链接,地址,介绍,开放时间,图片链接,评分,建议游玩时间,建议季节,门票,小贴士,Page
天山之夏狩猎场Kumul Tianshan Zhixia Hunting Ground,http://travel.qunar.com/p-oi711611-tianshanzhixiashoulie,"

地址:
哈密市区以东70公里处（沁城乡碱泉子墩）

",狩猎场自然地理环境好、交通便利、地势开阔，距沁城太阳沟、猴娃山及岩画较近，易于狩猎和开发，是一个集农、林、特禽养殖、野生动物繁殖、急救、狩猎、休闲度假为一体的综合服务体。狩猎场是一个天然的野生动物园，内有马鹿、鹅喉羚、北山羊、盘羊、猕猴、鸵鸟、孔雀、疙瘩鸡、珍珠鸡、火鸡、野鸡、野鸭、野兔等15余种野生动物，另建有陨石公园、土匪洞、神秘字、敖包、射箭场、飞碟射击场、靶场、滑冰场、钓鱼池、棋牌室等。2004年公司修建机场并购进轻型飞机和热气球等飞行器，推出了航猎及多种空中服务项目，向多元化经营发展。在天山之夏狩猎场游客能充分感受狩猎追逐野生动物的新鲜刺激，领略戈壁奇观海市蜃楼的亦真亦幻，探究陨石公园天外来物的神秘莫测，欣赏新疆古老坎儿井的巧妙构思，沁城太阳沟秀色、猴娃山情趣及唐代烽火台和史前岩画等古代遗址，更能品尝各类珍禽动物的美味和休闲度假的快乐。,全天,https://tr-osdcp.qunarzz.com/tr-osd-tr-manager/img/538e0971701be9ff5ae312e0f15b8c23.jpg_480x360x95_66421d10.jpg,5.0,建议游览时间：1小时,,具体收费情况以现场公示为主,,3
哈密戈壁滩,http://travel.qunar.com/p-oi38952547-hamigebitan,,,,,5.0,,,,,3
伊吾县前山乡“域龙时光民俗风情园”,http://travel.qunar.com/p-oi37801762-yiwuxianqianshanxiang,"

地址:
新疆维吾尔自治区哈密市伊吾县前山乡喀拉乌勒村


电话:
0902-6739888,18299924375

",前山景区位于前山哈萨克民族乡，是新疆维吾尔自治区哈密市伊吾县辖乡，位于县境西端。以西与巴里坤哈萨克自治县接界，东距县城70公里，南距哈密市160公里。景区具有独特的地理优势，是哈密通往伊吾县的必经之路，周边景区较多，每年通过举办伊吾县前山乡草原文化节、农牧民传统体育运动会吸引了哈密周边广大游客，已具有浓厚的旅游气氛。周边旅游资源丰富，南邻巴里坤白石头、松树塘、寒气沟等景点，西靠鸣沙山、巴里坤湖、香菇庙、兰州湾子等景点，北邻幻彩湖、胡杨林、蝴蝶谷、太阳历广场、伊吾烈士陵园等景区，东靠喀尔里克冰川等景点。本区位位于哈密市、巴里坤县、伊吾县的必经之路，在三地主要公路及景区交汇处，地理位置优越，环境宜人，具有独特的哈萨克族特色。（一）进入夏季，乃楞格尔大草原上一碧万顷的牧草衬托着盛开的百花，到处呈现出“风吹草低现牛羊”的优美草原风光，著名的“东山”马就出在该地。在草种中，有独特的阿拉善鹅冠草，是全疆罕见的优良草种，具有推广实用价值。野生动物资源主要有狐狸、野猪、野兔、鹅喉羚、大头羊、北山羊、马鹿、狼、雪豹、耗牛等。雨水充沛时，草场上有大量的野生蘑菇。（二）此处分布着数十座形状怪异的红石头群，有的形似骆驼，有的形似乌龟、银兔，形态各异、栩栩如生。奇山怪石与脚底下的潺潺溪水、茵茵绿草相映成趣。草原四面环山，山顶白云缭绕，雪峰若隐若现；山腰松林莽莽，层峦叠嶂，松涛阵阵，一片葱茏；草原上林草丰茂，绿草如茵，野花烂漫，百鸟争鸣；再加上山沟里的潺潺溪水、嶙峋怪石，更为草原增添了静谧、原始的色彩。每当盛夏来临，乃楞格尔草原更是美丽如画：羊群在绿海中飘荡，毡房在炊烟中忽隐忽现，好一派“天苍苍，野茫茫，风吹草低见牛羊”的优美胜景。（三）丰富而独具地方特色的民俗风情，是景区旅游多元而独特化的源泉。哈萨克族特有的摔跤、叼羊、赛马、姑娘追、阿肯弹唱等适合娱乐、休闲的文娱体育表演，更让草原散发出勃勃生机和浓郁的游牧风情。草原风光秀丽，景色迷人，气候湿润，凉风习习，确实是一块适合休闲、避暑、度假的旅游佳地。以“美丽乡村”和“特色小镇”建设为主题，深度开发哈萨克马文化和民俗文化，增强园区在人文景观上的建设。,5/1-9/30 全天开放,,5.0,,,具体收费情况以现场公示为主,,4
八大石Badaishi Scenic Spot,http://travel.qunar.com/p-oi10008815-badashi,,"八大石位于新疆哈密地区黄田农场北端喀尔里克山主峰--木尔提峰的南山坡上，海拔1900多米。这里有一处盛开樱花的山谷，哈密王曾在此修建了一所避言山庄，还开辟了一座占地百由的果园。园内栽值绿沙果、白沙果和樱桃等各类果木。由于该果园内有八块形态各异、比房屋还要高大的巨石，""八大石""便由此得名。",,https://tr-osdcp.qunarzz.com/tr-osd-tr-manager/img/780c13d9b43465161ed997768a7b55d5.jpg_480x360x95_acdfddd1.jpg,5.0,建议游览时间：3天,,,,8
猴娃山Houwa Mountain,http://travel.qunar.com/p-oi10008813-houwashan,,猴娃山，位于新疆维吾尔自治区哈密沁城乡南面东庙尔沟东北5公里处，长约两三公里，山势绵延起伏，沟壑纵横，一条洪水冲刷而成的蜿蜒便道贯穿其间。猴娃山的岩石经长时间的风化，形成了千奇百怪的形状，有的像鹰、有像熊、有的像人，有的似禽，姿态万千，而更多的怪石则酷似顽皮好动的猴子。山上有许多栩栩如生的石猴、石熊、石羊、石鹰等“雕像”，这不是出自能工巧匠之手，而是大自然鬼斧神工的杰作。烈日、雨雪、风暴，以其令人惊叹的力量，经过千万处锲而不舍的“雕琢”，终于形成了这一奇特景观。因这座小山上，有各种姿态石猴得名猴娃山。如身临其境，人们无不为之感叹，大自然的鬼斧神工造就出栩栩如生的动物怪石，真是一个静止的动物世界。猴娃山石头动物，不仅有神有色，还有声有韵，这里是戈壁风口，顺天山南下的北风四季不息，山风在怪石间穿回，形成回音，它会发出许多奇妙的音响，时如洞萧低吹，缕缕哀切；时如虎啸龙吟，浑厚深沉；时如铁骑突阵，高昂激越，这就更增加了猴娃山的神秘色彩。这真是一处独一无二的奇观异景。,,https://tr-osdcp.qunarzz.com/tr-osd-tr-manager/img/295eb85221c3e593231b5655aa83b1e5.jpg_480x360x95_75914fcc.jpg,5.0,建议游览时间：12小时 - 3天,,具体收费情况以现场公示为主,,8
白杨河佛教遗址Baiyang River Buddhism Ruins,http://travel.qunar.com/p-oi10002444-baiyanghefojiaoyizhi,,遗址散布在白杨河两岸高高的土崖上。河东有3个洞窟、1座佛塔和1座大佛寺。大佛残高8.2米，估计整身高度在15米以上。大佛寺大殿高5层，这在当时已经是高层建筑了。从白杨河上游到中下游六十余公里，还有一系列的佛教遗址，以及古坎儿井、焉不拉克古墓群、拉甫却克古城、艾斯克霞尔古城堡等。白杨河是一条璀璨的文化之河，其流域内的古文化被称为“焉不拉克文化”。,,https://tr-osdcp.qunarzz.com/tr-osd-tr-manager/img/5550d9568e51171ce97336abee99bc38.jpg_480x360x95_8f61677f.jpg,5.0,建议游览时间：1小时,,具体收费情况以现场公示为主,,8
伊吾幻彩湖Yiwu Huan Cai Lake,http://travel.qunar.com/p-oi10002440-yiwuhuancaihu,"

地址:
哈密市伊吾县盐池乡政府以北2公里处

",湖水无臭，半透明，因蕴藏着378万吨的盐矿和芒硝，而使得其水有苦碱味，为极咸的碱性水。该湖既无出口，也无入口，是由地下泉水汇集而成。车过盐池乡，远远望去一湖碧水、水天相连，沿着没膝深的草儿进入湖畔，草长莺飞，紫色、黄色、兰色的马莲花迎风绽放，香气袭人。幻彩湖的神奇之处在于，它随着天气的变化会呈现出不同的色彩。睛朗的日子，湖面像大海一样碧蓝，日落时分，晚霞映照，绿里透红；当要起风时，湖面呈粉红色，要下雨时，湖面呈紫色。当地牧民有趣的称它为“天气预报”湖，常言是“出门看天气”，盐池牧民是“出门看焕彩湖”。,全年 全天开放,https://tr-osdcp.qunarzz.com/tr-osd-tr-manager/img/58052fef2b7b49fa041be7d2622afa12.jpg_480x360x95_935177d6.jpg,5.0,建议游览时间：1小时,,具体收费情况以现场公示为主,,8
