名字,链接,地址,介绍,开放时间,图片链接,评分,建议游玩时间,建议季节,门票,小贴士,Page
十二连城,http://travel.qunar.com/p-oi712095-shierliancheng,,"在潼关县东约3公里的禁沟两岸,禁沟自秦岭之蒿岔口起，北至下屯村原头，南北共长约15公里。沟底由于长期山水的冲刷,形成宽3O米的平坦斜坡道，成为通往潼关城後侧一条军事要道。自唐代到明清，为了潼关的安全，沿禁沟两岸夯筑方形土台12个，每个底边长10.5米，宽11米，高7。6米，夯层厚9至14厘米，是防御性的军事堡垒。由于与潼关基本相连接，故俗呼为“十二连城”。现在城无存,烽火台存在。",,https://img1.qunarzz.com/travel/poi/201211/15/5cd010f7f64ea332ddb12cfb.jpg_480x360x95_35ec093d.jpg,5.0,,,,,1
朝阳台,http://travel.qunar.com/p-oi718100-chaoyangtai,"

地址:
华山景区内

",朝阳台在东峰绝顶，因是太阳最先照耀的地方，又是游人观赏华山日出的最佳位置，故名。东峰也因此被称为朝阳峰。 台面积约十平方米，因崖势向外悬空伸出，从远处望去，如同鹰嘴。游人行其上，往往有心旌神摇之感。台上苍松林立，浓荫蔽天，站林荫间向东望去，视野开阔，山岭连绵，千重翠浪尽收眼底。极目处，黄河如带，沃野无垠。游人每登华山，都将在处观赏日出作为第一幸事。,全天,https://img1.qunarzz.com/travel/poi/201408/13/f291bf9e72bcdf22c8d65eac.jpg_480x360x95_881de6b5.jpg,5.0,建议游览时间：4小时,四季均可，来华山看日出，这个地方是必去之地。,包含在华山门票中,1、早上看日出的时候温度较低，要注意带上御寒的衣服。2、附近也有出租军大衣的地方，必要的时候可以租一件御寒。,3
寇准墓Tomb of Kouzhun,http://travel.qunar.com/p-oi716150-kouzhunmu,,寇准墓位于渭南市临渭区，现存土冢南北长15米，东西宽8米，封土高4米。墓前有一通石碑，上刻：“宋寇莱公墓”5个字。此碑曾一度失落、被毁，现在墓前的碑为清乾隆年间渭南县知事邱估所立。碑文为当时任兵部侍郎、陕西巡抚兼都察院副都御史的毕沅所书。寇准华州下邽（今陕西渭南）人，是北宋著名的政治家﹑诗人，与白居易、张仁愿并称渭南“三贤”。寇准曾两度入相，一任枢密使，乾兴元年数被贬谪，终雷州司户参军，天圣元年 （1023） 九月，病逝于雷州。宋仁宗时令当时的翰林学士孙抃撰神道碑，谥“忠愍”，复爵“莱国公”，追赠中书令。,,https://img1.qunarzz.com/piao/fusion/1505/ce/a3f29e41da08e7.jpg_480x360x95_f983e8c8.jpg,5.0,建议游览时间：0.5小时,,具体收费情况以现场公示为主,,4
蒙汉合文碑,http://travel.qunar.com/p-oi708526-menghanhewenbei,"

地址:
渭南市合阳县城西门外路北

",又叫御宝圣旨碑，立于合阳县城西门外路北。此碑刻于元代延佑六年（公元1319年），碑高2．35米，宽1米，厚0．31米，座长1．40米，宽0．7米，高0．33米。碑圭阴纹。篆刻“御宝圣旨”四字，两边为阴线刻缠枝蔓草纹，碑文上边为蒙文，下边是汉文，内容为元代诸帝保护寺院的谕旨。碑阴有文，除年月和落款有别外，其余都与阳面相同。1985年于碑端建砖亭保护。现为省级重点文物保护单位。,全天,https://img1.qunarzz.com/travel/d2/1607/c0/ab1e34b85ef3db9a.jpg_480x360x95_bd519978.jpg,5.0,,,免费,,6
渭南市非物质文化遗产展示传习馆,http://travel.qunar.com/p-oi38962420-weinanshifeiwuzhiwenhua,,,,,5.0,,,,,8
桢州公园,http://travel.qunar.com/p-oi38596168-zhenzhougongyuan,,,,,5.0,,,具体收费情况以现场公示为主,,9
北营庙,http://travel.qunar.com/p-oi38339383-beiyingmiao,,,,,5.0,,,具体收费情况以现场公示为主,,9
渭南老街景区,http://travel.qunar.com/p-oi38335314-weinanlaojiejingqu,,,,,5.0,,,具体收费情况以现场公示为主,,10
