名字,链接,地址,介绍,开放时间,图片链接,评分,建议游玩时间,建议季节,门票,小贴士,Page
凉山第一寨,http://travel.qunar.com/p-oi38961149-liangshandiyizhai,,风景很有特色的彝族寨子，民俗活动体验，烧烤野炊的好去处，篝火晚会等项目期待您的体验,,,5.0,建议游览时间：3小时 - 5小时,,,,7
乐山犍为龙门花海景区,http://travel.qunar.com/p-oi38807058-leshanjianweilongmenhua,,犍为龙门花海占地面积1100亩其中七彩油菜花就有600多亩据了解，全四川仅有3个地方有这种大型七彩油菜花观赏园犍为龙门就是其中之一,,,5.0,,,,,8
背峰山公园,http://travel.qunar.com/p-oi36393527-beifengshangongyuan,"

地址:
沙坪镇背峰山

","这是由曾经的荒山改造而成的休闲公园，登上背峰山，人们可以眺望全城风景，山上大概有五千多级台阶，登山途中设有多个烽火台。
",全天免费开放,,5.0,建议游览时间：3小时 - 4小时,,具体收费情况以现场公示为主,,10
四峨山梯田Si'eshan Terraces,http://travel.qunar.com/p-oi35912731-sieshantitian,,,,,5.0,,,具体收费情况以现场公示为主,,10
