名字,链接,地址,介绍,开放时间,图片链接,评分,建议游玩时间,建议季节,门票,小贴士,Page
天子山农业公园Tianzishan Agricultural Park,http://travel.qunar.com/p-oi35306897-tianzishannongyegongyuan,"

地址:
汕尾市海丰县赤石镇大安村何兴围公路200米

",坐落于深汕合作区赤石镇大安村，是集住宿、温泉、休闲度假、餐饮美食、会议商务、康体娱乐、团队拓展于一体的综合性旅游度假之地。按照中国风标准建造，建筑宏伟壮丽，占地面积14万平方米，拥有特色酒店式木屋、古色古香的家庭式庭院民宿、露天温泉池；以及农园水果采摘、烧烤、古农耕文化体验、国学课程、汉服写真等多种娱乐设施。,全年 09:00-20:00,,5.0,建议游览时间：2小时 - 3小时,,,,8
莲花山森林公园Lianhua Mountain Sceneic Area,http://travel.qunar.com/p-oi35216191-lianhuashansenlingong,,莲花山风景区位于海丰县四季如春的莲花山脉，海丰八景的“莲峰叠翠”和“银瓶飞瀑”之间。游人来此远足登高，便可见层林叠嶂，连绵不尽，俯仰之间恍如身临人间仙境，其中海拔1336米的莲花山脉主峰，是登高赏景的较好地点。莲花山风景区以鸡鸣寺为主体建筑，该寺历史悠久，可追溯至公元1633年，因海丰连续发生5次天灾，来此化缘的印真和尚在莲花山建造庵寺，为海丰聚福，如今已历近400年。游人来到莲花山，不妨选购一些山上特产的莲花山茶，泡以莲花山泉水，格外沁人心脾。,,,5.0,,,具体收费情况以现场公示为主,,9
