名字,链接,地址,介绍,开放时间,图片链接,评分,建议游玩时间,建议季节,门票,小贴士,Page
石柱观,http://travel.qunar.com/p-oi3864472-shizhuguan,,建始望坪是一马平川，坪中有一山峰隆起，突兀凌空，尤如擎天大柱，人们称为蟠龙山。这山海拔为1070米，相对高度51米，周长223米。山顶有一庙宇，古人称朝贞观，今人叫它石柱观。？？？？蟠龙山山势险峻，整个山体是悬崖绝壁，山麓有洞穴，迂回曲折通向山腰，出半山洞口，有238级石梯依山势盘旋至山顶。山顶苍松横生，山花竞放，庙宇掩翳在秀林古木之中。庙始建于明嘉靖年间，传说当年有一樵夫上蟠龙山捡柴，在半岩石缝中拾得半截庙钟，钟上残留“峨嵋”二宇，怀疑是四川峨眉山的神仙...建始望坪是一马平川，坪中有一山峰隆起，突兀凌空，尤如擎天大柱，人们称为蟠龙山。这山海拔为1070米，相对高度51米，周长223米。山顶有一庙宇，古人称朝贞观，今人叫它石柱观。？？？？蟠龙山山势险峻，整个山体是悬崖绝壁，山麓有洞穴，迂回曲折通向山腰，出半山洞口，有238级石梯依山势盘旋至山顶。山顶苍松横生，山花竞放，庙宇掩翳在秀林古木之中。庙始建于明嘉靖年间，传说当年有一樵夫上蟠龙山捡柴，在半岩石缝中拾得半截庙钟，钟上残留“峨嵋”二宇，怀疑是四川峨眉山的神仙降灵，四乡群众因此相邀在 山顶修筑庙宇。四百多年来，石柱观几经兵燹，重建数次。现存的土木结构是清代重建，高10．97米，外形呈四层六棱亭阁状，顶部为六面迭歇山式，飞角是鸱首式，内设前堂后殿，东西两厢，左右茶舍膳房，布局合理，造型雄伟，工艺精致，显示出工匠的聪明才智。？？？？蟠龙山周围有风景三处，山西有清建宝塔一座，右侧崖缝中有一涓流，久早不竭；东麓有一堰池，碧波荡漾，常年不干。石柱观兼有山、水、石、洞四美，是鄂西的一个游览胜地。,,,5.0,,,,,2
鸡公山森林公园,http://travel.qunar.com/p-oi3864478-jigongshansenlingongyuan,,鸡公山森林公园鸡公山原始森林是坪坝营原始森林的一个代表。这里是一个充满神奇、神秘的世界，这里是动植物生长繁衍的天堂。林内古树参天，藤蔓缠绕，朽木满山，奇花遍地，豹鸣深山，云雾缭绕。森林中的山、水、瀑、花、草、树等处处流淌着原始的汁液。“硕大的古树，粗壮的藤蔓，厚厚的腐殖质层，倒伏千百年的枯木朽树，四散漫布的苔藓(青苔)”等原始森林的五大特征尽显其中。华南虎、金钱豹、花面狸、锦鸡、穿山甲、野猪、兔子等500种动物；古树杜鹃、珙桐、红豆杉、鹅掌楸等130...鸡公山森林公园鸡公山原始森林是坪坝营原始森林的一个代表。这里是一个充满神奇、神秘的世界，这里是动植物生长繁衍的天堂。林内古树参天，藤蔓缠绕，朽木满山，奇花遍地，豹鸣深山，云雾缭绕。森林中的山、水、瀑、花、草、树等处处流淌着原始的汁液。“硕大的古树，粗壮的藤蔓，厚厚的腐殖质层，倒伏千百年的枯木朽树，四散漫布的苔藓(青苔)”等原始森林的五大特征尽显其中。华南虎、金钱豹、花面狸、锦鸡、穿山甲、野猪、兔子等500种动物；古树杜鹃、珙桐、红豆杉、鹅掌楸等1300余种植物树种；白龙须、四季参、毛鸡腿、野芹菜、野洋合、鸭脚七等70多种具有保健功能的野菜；野草莓、野樱桃、野生猕猴桃、野荔枝、八月瓜、野板栗、锥栗等180余种野果，定会让您一饱眼福或口福。百鸟欢叫、清脆婉转，群兽低吟，浑厚有力，在茫茫林海中萦绕回荡，宛若一首森林的交响曲。 电影《丛林无边》外景拍摄基地： 2004年4月由中华民族文化促进会，北京红色世纪影视文化传播有限公司、中共成丰县委、成丰县人民政府联合摄制的由郑克洪导演执导的电影《丛林无边》，因看中了坪坝营迷人的自然生态景观，把坪坝营森林公园确定为了外景拍摄基地，成功拍摄了电影《丛林无边》。该电影是根据1935年夏天发生在湘鄂革命根据地所在地著名的湖北成丰的“忠堡大捷”的史实改编的。现保留的景观有老猎屋、捕兽陷井等。,,https://img1.qunarzz.com/piao/fusion/1612/91/aa4646f833dfd702.jpg_480x360x95_3550c743.jpg,5.0,,,,,2
土王城遗址,http://travel.qunar.com/p-oi3864460-tuwangchengyizhi,,又名万全洞。在鹤峰县城东北8公里搂水北岸平山悬崖间。隔河与悬崖绝壁对峙，高出河面百余米，仅羊肠一径坎坷下达。一夫当关，万夫莫开。昔容美土司田舜年在此大事营建。洞口有石门、石墙，内深约70米，“可容千人，左就月轩，右受日亭，其中为大士阁”。深处有“魏博楼”，立有容美土司先人魏博节度使田弘正偶像牌位等。清文士顾采往游时，田舜年“张乐焚香”、“举诗会”、“命石工磨崖间片石，如镜，珠书刻之”。末代土司田明如，据此抗拒清政府“改土归流”，至雍正十一年（1733年...又名万全洞。在鹤峰县城东北8公里搂水北岸平山悬崖间。隔河与悬崖绝壁对峙，高出河面百余米，仅羊肠一径坎坷下达。一夫当关，万夫莫开。昔容美土司田舜年在此大事营建。洞口有石门、石墙，内深约70米，“可容千人，左就月轩，右受日亭，其中为大士阁”。深处有“魏博楼”，立有容美土司先人魏博节度使田弘正偶像牌位等。清文士顾采往游时，田舜年“张乐焚香”、“举诗会”、“命石工磨崖间片石，如镜，珠书刻之”。末代土司田明如，据此抗拒清政府“改土归流”，至雍正十一年（1733年）败亡。,,,5.0,,,,,3
双乳峰古树杜鹃群落,http://travel.qunar.com/p-oi3864482-shuangrufenggushudujuan,,双乳峰古树杜鹃群落万亩成片古树杜鹃是坪坝营的一大奇观，特别是在海拔l700米以上大面积生长十分罕见，最大的一棵杜鹃胸径达2．5米，树龄一千年以上。这里的杜鹃不是平常所说的映山红，映山红是灌木，这里的杜鹃生长在高海拔区，成片生长，面积非常大。主要有两个品种，一是血红杜鹃，春季开花，花为红色和粉红色。另一种是云锦杜鹃，盛夏的时候开花，花为白色，开花的时候，满山遍野，如云似锦。,,https://img1.qunarzz.com/travel/d4/1507/e9/79b60ba743839b.jpg_480x360x95_858f8d48.jpg,5.0,,,,,3
青云阁观景亭,http://travel.qunar.com/p-oi3864480-qingyungeguanjingting,,青云阁观景亭青云阁始建于清末民国初期，2003年全面进行修复，位于坪坝营生态旅游区核心地带，距野风宾馆450米，海拔l700米，阁高18米，三层六角形仿古式构造，气势宏伟，建筑精妙，登阁游览，可瞰万倾林海观云海日出，领略大自然无限风光，令您心旷神怡，让您置身于仙境的感常。,,https://img1.qunarzz.com/travel/d8/1506/f9/7755772b06f2da.jpg_480x360x95_cb3a6349.jpg,5.0,,,,,3
恩施不夜城,http://travel.qunar.com/p-oi40002207-enshibuyecheng,,恩施不夜城通过文化展示、情景再现、情景演绎、创意科技等手法，打造集文化体验、美食畅享、夜间休闲、民俗娱乐、休闲度假等于一体的元宇宙数字化沉浸式、具有现代感、时尚艺术化的巴文化旅游休闲景区。,,,5.0,建议游览时间：1小时 - 2小时,,,,4
一柱香,http://travel.qunar.com/p-oi38984213-yizhuxiang,,,,,5.0,,,,,4
华盾克瑞斯庄园,http://travel.qunar.com/p-oi37806879-huadunkeruisizhuangyuan,,,,,5.0,,,具体收费情况以现场公示为主,,9
川美美术馆,http://travel.qunar.com/p-oi37190095-chuanmeimeishuguan,,,,,5.0,,,具体收费情况以现场公示为主,,10
