名字,链接,地址,介绍,开放时间,图片链接,评分,建议游玩时间,建议季节,门票,小贴士,Page
碧海银滩公园,http://travel.qunar.com/p-oi36409542-bihaiyintangongyuan,"

地址:
新埠街道新埠岛埠北环路北

","碧海银滩公园内有沙池、滑梯和跷跷板，沙子细腻柔软，另外，公园内还有很多道具，非常适合拍照打卡。
",全年 全天开放,,5.0,建议游览时间：2小时 - 3小时,,具体收费情况以现场公示为主,,1
新华南路,http://travel.qunar.com/p-oi5740423-xinhuananlu,,,,https://img1.qunarzz.com/travel/d4/1608/5d/3fca60683f7d21b5.jpg_480x360x95_89dac5a9.jpg,5.0,,,,,4
华彩.杰鹏游艇会,http://travel.qunar.com/p-oi38797976-huacaijiepengyoutinghui,,,,,5.0,,,具体收费情况以现场公示为主,,7
海口西海岸挺秀公园,http://travel.qunar.com/p-oi38335011-haikouxihaiantingxiugong,,,,,5.0,,,具体收费情况以现场公示为主,,8
白沙门沙滩,http://travel.qunar.com/p-oi38135639-baishamenshatan,,白沙门沙滩位于海口市美兰区，附近有沙滩足球，排球的比赛场地，人们在这里捡贝壳，吹海风，踏海浪，非常放松惬意。,,,5.0,建议游览时间：1小时 - 2小时,,具体收费情况以现场公示为主,,8
鸭尾溪湿地公园,http://travel.qunar.com/p-oi36410935-yaweixishidigongyuan,"

地址:
人民大道与海甸五中路交汇处东南侧

",鸭尾溪湿地公园种植有红树林科植物秋茄树， 小河两旁修建有绿荫小道，适合散步。,全年 全天开放,,5.0,建议游览时间：2小时,,,,10
