名字,链接,地址,介绍,开放时间,图片链接,评分,建议游玩时间,建议季节,门票,小贴士,Page
水杉山庄,http://travel.qunar.com/p-oi718825-shuishanshanzhuang,"

地址:
华蓥市天池镇仰天窝

",水杉山庄位于华蓥市天池镇仰天窝，属华蓥山森林公园一期工程，1997年建成使用。山庄地处高山，四周环绕着上万亩天然白夹竹、阔叶林和杉木、马尾松人工林，分布有“植物活化石”水杉林、枫树林、柳杉林、花竹和小石林等景点，冬可观雪景，盛夏可避暑。同时，随着华蓥山森林公园二期工程建设的启动，将建立二星级旅游接待中心及森林沐浴区、 山顶牧场、儿童游乐设施、实弹射击场等。山庄交通便捷，服务功能完善，现为国家AA级旅游区，是人们休闲度假的好去处。,全天,,5.0,,,免费,,1
铜锣山生态旅游度假区梦想家乐园,http://travel.qunar.com/p-oi38339295-tongluoshanshengtailu:,,景区面积2200亩，资源丰富，有银杏、楠木、香樟、桂花、枫香、马尾松、柳杉、楠竹、刺黑竹等天然树竹资源；有野猪、刺猬、黄麂、猫头鹰、山喳等野生动物资源，含氧量高，生态宜居。森林康养酒店1个，生态餐厅1个，林间木屋8间，林间玻璃高空游憩平台，森林游步道，仙女湖。奇幻梦想家园区内儿童游艺区（卡丁车，高空秋千，丛林穿越，蹦蹦云，儿童游乐拓展设备...）萌宠观赏区（羊驼、矮马、香猪、浣熊、骆驼、羊、土拨鼠...）鸟语林（孔雀、鹦鹉、珍珠鸡、七彩山鸡...），花海，观景平台，生态体感步道等。,,,5.0,建议游览时间：3小时 - 5小时,,,,2
